{"interface_version":1,"command":"index status","success":true,"exit_code":0,"data":{"operation":"status","state":"missing","versions":{"runtime":{"projection":2,"object_contract":2,"locator":2,"relation_schema":2,"parser":1,"tokenizer":1,"segment_algorithm":1},"index":null},"snapshot":{"current":"sha256:aaaaaaaaaaaaaaaaaaaaaaaaaaaaaaaaaaaaaaaaaaaaaaaaaaaaaaaaaaaaaaaa","indexed":null},"counts":{"objects":0,"relations":0,"sections":0,"segments":0,"citations":0},"changed_paths":[],"findings":[]},"warnings":[],"errors":[]}
