{"interface_version":1,"command":"search","success":true,"exit_code":0,"data":{"query":"knowledge","scope":"trusted-local","filters":{"kind":null,"subtype":null,"visibility":null,"record_status":null,"workflow_stage":null,"maturity":null,"review_status":null,"tags":[],"role":null},"limit":20,"index_versions":{"projection":2,"tokenizer":1,"segment_algorithm":1},"hits":[],"count":0},"warnings":[],"errors":[]}
