{"interface_version":1,"command":"context","success":true,"exit_code":0,"data":{"query":"knowledge","scope":"trusted-local","limit":20,"max_chars":12000,"groups":{"sources":[],"facts":[],"human_notes":[],"snippets":[]},"exclusions":[],"character_count":0,"truncated":false,"excluded_count":0,"notice":"This result is not a Phase 6B publish certification."},"warnings":[],"errors":[]}
